{
  "$comment": [
    "这是『人工持有』的废弃登记册：库里**曾经有 / 现在有但将来要删**的公开名字。",
    "",
    "⚠️ 为什么它必须存在（M9 · 0.7.7）",
    "   移除一个公开名字（令牌 / 类名）是**对下游的破坏性变更**，",
    "   而此前它是**不受任何门禁约束**的：0.7.4 移除了 `--measure`，",
    "   更新日志里记了一笔，但没有一处机器可读的地方说清楚：",
    "     · 它什么时候开始算废弃的",
    "     · 什么时候**允许**真的删",
    "     · 删了之后该用什么替代",
    "   ⇒ 下游只能靠读更新日志的人肉记忆来迁移。这是不可接受的。",
    "",
    "   对标 Primer 的 Deprecated / Removed 两档：废弃要有告警、有替代方案、",
    "   提前公告、并用 codemod 或 lint 阻断继续使用。我们没有 codemod，",
    "   所以『迁移窗口』只能用**版本号的距离**来表达 —— 这就是 policy.minLead。",
    "",
    "🔴 两个桶的区别（不要混用）",
    "   planned     走流程的：先登记，到 removeIn 才允许删。判据双向看住它。",
    "   retroactive 事后补登：**已经删了**才来登记的。它是历史欠账，不是流程。",
    "     ⇒ 数量写死在 budget.retroactive 里当棘轮：想再加一条，必须改预算，",
    "       而改预算是一次**看得见的、需要说明理由**的改动。"
  ],
  "schemaVersion": "1.0.0",
  "policy": {
    "minLead": "至少跨一个次版本：0.7.x 废弃 ⇒ 最早 0.8.0 才允许移除",
    "$whyMinLead": "本库一天可能发好几个修订号，用『修订号个数』当窗口等于没有窗口。只有次版本/主版本的推进才是下游会专门安排迁移的节奏。",
    "$whatWeCannotDo": "诚实边界：我们**没有** codemod、也没有运行时告警（组件 JS 不打印 console.warn，那是移动端 WebView 的噪音）。所以这个窗口只是『版本号承诺』，不是技术阻断。"
  },
  "planned": [
    {
      "id": "state--delayed",
      "kind": "class",
      "name": "state--delayed",
      "deprecatedIn": "0.7.7",
      "removeIn": "0.8.0",
      "reason": "这个类承诺了一个『延迟显现』的机制，但全库**没有任何 JS** 会去设置它所依赖的 data-state=\"shown\" ⇒ 使用者必须自己接，而文档没写。它读起来像本库已经实现了 —— 这类名字最危险，因为误会发生在读者脑子里，代码不会报错。",
      "replacement": null,
      "replacementNote": "没有替代品：想要延迟显现，自己给元素加 data-state=\"shown\" 即可（states.css 里那两行就是全部实现）。",
      "$evidence": "05-audit/dead-class-gate.py 把它列在『真死类候选』里，并注明『全库没有任何 JS 加过它』。"
    }
  ],
  "retroactive": [
    {
      "kind": "token",
      "name": "--measure",
      "removedIn": "0.7.4",
      "replacement": ["--measure-page", "--measure-prose"],
      "$why": "0.7.4 移除它的时候，这套流程还不存在。补登是为了让它**不从历史里消失**，不是为了让那次移除看起来走过流程 —— 那次就是没走。"
    }
  ],
  "budget": {
    "retroactive": 1
  }
}
